BiblioID,Reference
i34BIO,"Eijala, J.K., Egbogbo, O. & Anigboro, A.A. 2009. Proximate composition and cholesterol concentrations of Rynchophorus phoenicis and Oryctes monoceros larvae subjected to different heat treatments. African Journal of Biotechnology, 8(10): 2346–2348."
i35BIO,"Ekpo, K.E. 2010. Nutrient composition, functional properties and anti-nutrient content of Rhynchophorus Phoenicis (F) larva. Annals of Biological Research, 1(1): 178–190."
i36BIO,"Ekpo, K.E. 2011. Nutritional and biochemical evaluation of the protein quality of four popular insects consumed in Southern Nigeria. Archives of Applied Science Research, 3(5): 428–444."
i37BIO,"Elemo, B.O., Elemo, G.N., Makinde, M.A. & Erukainure, O.L. 2011. Chemical evaluation of African palm weevil, Rhychophorus phoenicis, larvae as a food source. Journal of Insect Science, 11: 146."
i38BIO,"Ghaly, A.E. 2009. The use of insects as human food in Zambia. OnLine Journal of Biological Sciences, 9(4): 93–104."
i39BIO,"Ghaly, A.E. & Alkoaik, F.N. 2009. The yellow mealworm as a novel source of protein. American Journal of Agricultural and Biological Sciences, 4(4): 319–331."
i41BIO,"Hunt, A.S., Ward, A.M. & Ferguson, G. 2001. Effects of a high calcium diet on gut loading in varying ages of crickets (Acheta domesticus) and mealworms (Tenebrio molitor). In M. Edwards, K.J. Lisi, M.L. Schlegel & R.E. Bray, eds. Proceedings of the Fourth Conference on Zoo and Wildlife Nutrition. Lake Buena Vista, USA, AZA Nutrition Advisory Group."
i42BIO,"Hocking, B. & Matsumura B. 1960. Bee brood as food. Bee World, 41(5): 113–120."
i43BIO,"Gope, B. & Prasad, B. 1983. Preliminary observations on the nutritional value of some edible insects of Manipur. Journal of Advanced Zoology, 4(1): 55–61."
i44BIO,"Jones, L.D., Cooper, R.W. & Harding, R.S. 1972. Composition of mealworm Tenebrio molitor Larvae. Journal of Zoo and Animal Medicine, 3(4): 34–41."
i45BIO,"Kamarudin, N., Moslim, R., Arshad, O., Wahid, M.B. & Chong, A. 2007. Potential of using rhinoceros beetles (Oryctes rhinoceros) as an ornamental fish feed supplement. Journal of Palm Oil Research, 19: 313–318."
i46BIO,"Kinyuru, J.N., Kenji, G.M., Muhoho, S.N. & Ayieko, M. 2010. Effect of processing methods on the In Vitro protein digestibility and vitamin content of edible winged termite (Macrotermes subhylanus) and grasshopper (Ruspolia differens). Food Bioprocess Technology, 3(5): 778–782."
i47BIO,"Kinyuru, J.N., Kenji, G.M., Muhoho, S.N. & Ayieko, M. 2010. Nutritional potential of longhorn grasshopper (Ruspolia differens) consumed in Siaya District Kenya. Journal of Agriculture, Science and Technology, 12(1): 32–46."
i48BIO,"Mariod, A.A., Abdel-Wahab, S.I. & Ain, N.M. 2011. Proximate amino acid, fatty acids and mineral composition of two Sudanese edible pentatomid insects. International Journal of Tropical Insect Science, 31(3): 145–153."
i49BIO,"Newton, G.L., Booram, C.F., Barker, R.W. & Hale, O.M. 1977. Dried Hermetia illucens larvae meal as a supplement for swine. Journal of Animal Science, 44(3): 395–400."
i50BIO,"Landry, S., DeFoliart, G.R. & Sunde, M.L. 1986. Larval protein quality of six species of Lepidoptera (Saturniidae, Sphingidae, Noctuidae). Journal of Economic Entomology, 79(3): 600–604."
i51BIO,"Ng, W-K., Liew, F-L., Ang, L-P. & Wong, K-W. 2001. Potential of mealworm (Tenebrio molitor) as an alternative protein source in practical diets for African catfish, Clarias gariepinus. Aquaculture Research, 32(s1): 273–280."
i52BIO,"Ohtsuka, R., Kawabe, T., Inaoka, T., Suzuki, T., Hongo, T., Akimichi, T. & Sugahara, T. 1984. Composition of local and purchased foods consumed by the Gidra in Lowland Papua. Ecology of Food and Nutrition, 15(2): 159–169."
i54BIO,"Oonincx, D.G.A.B. & Dierenfeld, E. 2011. An investigation into the chemical composition of alternative invertebrate prey. Zoo Biology, 29: 1–15."
i55BIO,"Oyarzun, S.E., Crawshaw, G.J. & Valdes, E.V. 1996. Nutrition of the Tamandua: I. Nutrient composition of termites (Nasutitermes spp.) and stomach contents from wild tamanduas (Tamandua tetradacytyla). Zoo Biology, 15(5): 509–524."
i56BIO,"Phelps, R.J., Struthers, J.K. & Moyo, S.J. 1975. Investigations into the nutritive value of Macrotermes falciger (Isoptera: Termitidae). Zoologica Africana, 10(2): 123–132."
i57BIO,"Yhoung-Aree, J., Puwastien, P. & Attig, G.A. 1997. Edible insects in Thailand: An unconventional protein source? Ecology of Food and Nutrition, 36(2–4): 133–149."
i58BIO,"Barker, D. 1997. Preliminary observations on nutrient composition differences between adult and pinhead crickets, Acheta domestica. Bulletin of the Association of Reptilian Amphibian Veterinarians, 7(1): 10–13."
i59BIO,"Dierenfeld, E.S. 2002. Some preliminary observations on herbivorous insect composition: Nutrient advantages from a Green Leaf Diet? In Symposium of the Comparative Nutrition Society. Antwerp, Belgium, Antwerp Zoo. "
i60BIO,"Ademolu, K.O., Idowu, A.B., & Olatunde, G.O. 2010. Nutritional value assessment of variegated grasshopper, Zonocerus variegatus (L.) (Acridoidea: Pygomorphidae), during post-embryonic development. African Entomology, 18(2): 360–364."
i61BIO,"El-Hassan, N.M., Hamed, S.Y., Hassan, A.B., Eltayeb, M.M. & Babiker, E.E. 2008. Nutritional evaluation and physiochemical properties of boiled and fried tree locust, Pakistan Journal of Nutrition, 7(2): 325–329."
i63BIO,"Bernard, J.B. & Allen, M.E. 1997. Feeding captive insectivorous animals: Nutritional aspects of insects as food. Nutrition Advisory Handbook Fact Sheet 003. AZA Nutrition Advisory Group. (also available at https://nagonline.net/801/feeding-captive-insectivorous-animals-nutritional-aspects-insects-food/)."
i64BIO,"Igwe, C.U., Ujowundu, C.O., Nwaogu, L.A., Okwu, G.N. 2011. Chemical analysis of an edible African termite, Macrotermes nigeriensis; a potential antidote to food security problem. Biochemistry & Analytical Biochemistry, 1(1)."
i66BIO,"Grabowski, N.T. & Nowak, B. 2008. Proximate chemical composition of long-horned and short-horned grasshoppers (Acheta domesticus, Schistocerca gregaria and Phymateus saxosus) available commercially in Germany. Archiv für Lebensmittelhygiene, 59(6): 204–208."
i67BIO,"Ghaly, A.E. & Alkoaik, F.N. 2010. Nutritional value of the maize stalk borer and American bollworm as unconventional protein sources. American Journal of Applied Sciences, 7(1): 1–12."
i68BIO,"Melo, V., Garcia, M., Sandoval, H., Jiménez, H.D. & Calvo, C. 2011. Quality proteins from edible indigenous insect food of Latin America and Asia. Emirates Journal of Food and Agriculture, 23(3): 283–289."
i7BIO,"Okaraoye, C.C. & Ikewuchi, J.C. 2008. Rhynchophorus phoenicis (F) larva meal: nutritional value and health implications. Journal of Biological Sciences, 8(7): 1221–1225."
IN17,"Longvah, T., Ananthan, R., Bhaskarachary, K. & Venkaiah, K. 2017. Indian Food Composition Tables. Hyderabad, India, National Institute of Nutrition. (also available at http://www.ifct2017.com/frame.php?page=home)."
k2014,"Kameni, A., Kouebou, C., Aboubakar, D.A.K. & C., The. 2014. Effect of wheat flour substitution, maize variety and fermentation time on the characteristics of Akara, a deep oil fried dough product. African Journal of Food Science, 8(3): 104–111."
KA2003,"Kansci, G., Genot, C., Kamdem, A.M., Chana, A., Viau, M., Rampon, V., Metro, B. & Moreau, N. 2003. Composition et niveau, d’oxydation de quelques huiles végétales consommées au Cameroun, déterminées par des méthodes classiques et par spectroscopie moyen infrarouge. Sciences des Aliments, 23(3): 425–442."
KEN18,FAO & Government of Kenya. 2018. Kenya Food Composition Tables [online]. Nairobi. [Cited December 2018]. http://www.kilimo.go.ke/wp-content/uploads/2018/10/KENYA-FOOD-COMPOSITION-TABLES-2018.pdf
Lb2000,"Loura, B.B., Mapongmetsem, P.M., Nkongmeneck, B.A., Foko, J., Kapchie, V. & Denedoumba, D. 2000. Caractérisation physico-chimique de deux Myrtacées alimentaires endémiques des savanes soudano-guinéennes (Adamaoua, Cameroun). Cameroon Journal of Biological and Biochemical Sciences, 10(1): 61–69."
MA1000,PROSLABS. 2016. Food composition analysis of foods sampled in Mali and analysed by PROSLABS. (Unpublished)
MA1018,"Toury, R., Giorgi, R., Favier, J.C. & Savina, J.F. 1967. Aliments de l’Ouest Africain: Tables De Composition. Annales de la Nutrition et de l’Alimentation, 21(2): 73–127."
MB2005,"Bih Achu, M., Fokou, E., Tchiégang, C., Fotso, M. & Mbiapo Tchouanguep, F. 2005. Nutritive value of some Cucurbitaceae oilseeds from different regions in Cameroon. African Journal of Biotechnology, 4(11): 1329–1334."
MEGNIA,"Megnanou, R-M. & Niamke, S. 2015. Improving the optimized shea butter quality: a great potential of utilization for common consumers and industrials. Springerplus, 4(1): 667."
NC2009,"Newilah, G.N., Dhuique-Mayer, C., Rojas-Gonzalez, J., Tomekpe, K., Fokou, E. & Etoa, F.X. 2009. Carotenoid contents during ripening of banana hybrids and cultivars grown in Cameroon. Fruits, 64(4): 197–206."
NG1007,"Adepoju, O.T. & O. A. Omotayo. 2014. Nutrient composition and potential contribution of winged termites (Macrotermes bellicosus smeathman) to micronutrient intake of consumers in Nigeria. British Journal of Applied Science & Technology, 4(7): 1149–1158."
NG1008,"Adepoju, O.T & Adeniji, P.A. 2012. Nutrient composition and micronutrient potential of three wildly grown varieties of African star apple (Chrysophyllum albidum) from Nigeria. African Journal of Food Science, 6(12): 344–351."
NG1010,"Adepoju, O.T., Adekola, Y.G., Mustapha, S.O. & Ogunola, S.I. 2010. Effect of processing methods on nutrient retention and contribution of cassava (Manihot spp) to nutrient intake of Nigerian consumers. African Journal of Food, Agriculture, Nutrition and Development, 10(2): 1–13. "
NG1011,"Adesuyi, A.O., Elumm, I.K., Adaramola, F.B. & Nwokocha, A.G.M. 2012. Nutritional and phytochemical screening of Garcinia kola. Advance Journal of Food Science and Technology, 4(1): 9–14."
NG1012,"Adetunde, O.T., Oluseyi, T.O., Oyeyiola, A.O., Silva, B.O., Olayinka, K.O. & Alo, B.I. 2012. Effects of roasting on the proximate composition and levels of polycyclic aromatic hydrocarbons in some roasted Nigerian delicacies. Journal of Emerging Trends in Engineering and Applied Sciences (JETEAS), 3(5): 857–862."
NG1016,"Afoakwa, E.O., Sefa-Dedeh, S. & Agyir-Sackey, E.K. 2003. Chemical composition and effect of processing on oxalate content of taro corms. Food Chemistry, 85(4): 479–487."
NG1018,"Agbaire, P.O. 2011. Nutritional and anti-nutritional levels of some local vegetables (Vernomia amgydalina, Manihot esculenta, Teiferia occidentalis, Talinum triangulare, Amaranthus spinosus) from Delta State, Nigeria. Journal of Applied Sciences and Environmental Management, 15(4): 625–628."
NG1020,"Agomuo, J.K., Akajiaku, L.O., Alaka, I.C. & Taiwo, M. 2016. Mineral and antinutrients of fresh and squeeze-washed bitter leaf (Vernonia amygdalina) as affected by traditional de-bittering methods. European Journal of Food Science and Technology, 4(2): 21–30."
NG1022,"Ahmad, S.M., Birnin-Yauri, U.A., Bagudo, B.U & Sahabi, D.M. 2013. Comparative analysis on the nutritional values of crayfish and some insects. African Journal of Food Science and Technology, 4(1): 9–12."
NG1023,"Ajai, A.I., Bankole, M., Jacob, J.O. & Audu, U.A. 2015. Determination of some essential minerals in selected edible insects. African Journal of Pure and Applied Chemistry, 7(5): 194–197."
NG1026,"Aku, F.U. 2015. Composition and antimicrobial properties of selected local spices Monodora myristica (Ehuru), Piper guineense (Uziza), Xylopia aethiopica (Uda). Michael Okpara University of Agriculture. (Undergraduate project)"
NG1035,"Asegbeloyin, J.N. & Onyimonyi, A.E. 2007. The effect of different processing methods on the residual cyanide of gari. Pakistan Journal of Nutrition, 6(2): 163–166."
NG1037,"Atasie, V.N. & Akinhanmi, T.F. 2009. Extraction, compositional studies and physico-chemical characteristics of palm kernel oil. Pakistan Journal of Nutrition, 8: 800–803."
NG1039,"Aywa, A. K., Nawiri, M.P. & Nyambaka, H.N. 2013. Nutrient variation in colored varieties of Ipomea batatas grown in Vihiga County, Western Kenya. International Food Research Journal, 20(2): 819–825."
NG1040,"Ayoola, P.B., Adeyeye, A. & Onawumi, O.O. 2012. Chemical evaluation of food value of groundnut (Arachi hypogaea) seeds. American Journal of Food and Nutrition, 2(3): 55–57."
NG1045,"Bello, K. 2013. Effect of processing method on the proximate and mineral composition of prawn (Penaeus notialis). Journal of Global Biosciences, 2(2): 42–46."
ng1049,"Boateng, M., Okai, D.B., Frimpong, Y.O. & Asabere, C.O. 2014. A comparative study of the nutritional and microbial profiles of the raw and processed seeds of the African Locust Bean (Parkia biglobosa). Livestock Research for Rural Development, 26(10): 178."
NG1050,"Charlie, A.M. 2014. Proximate, Phytochemicals and Anti-Nutrient Composition of Selected Green Leafy Vegetables Consumed in Cross River State. Department of Biochemistry, University of Calabar. (Undergraduate project)"
NG1051,"Chikwendu, N.J. 2007. Chemical composition of four varieties of groundbean. Journal of Agriculture, Food, Environment and Extension, 6(2): 73–84."
NG1052,"Chinma, C.E., Abu, J.O & Adani, O.P. 2012. Proximate composition, physical and sensory properties of non-wheat cakes from acha and bambara nut flour blends. Nigerian Journal of Nutritional Sciences, 33(1): 7–11"
NG1058,"Echendu, C.A., Obizoba, I.C. & Anyika, J.U. 2009. Effects of heat treatments on chemical composition of groundbean (Kerstingiella geocarpa harm). Pakistan Journal of Nutrition, 8(12): 1877–1883, "
NG1061,"Ejembi, D., Sanni, M., Emmanuel, F. & Abbah, O. 2014. Evaluation of the biochemical composition and proximate analysis of indomie noodles. International Journal of Medical and Applied Sciences, 3(1): 166–175."
NG1068,"Elkhalifa, A.E., Ayat M.H & Abu Zei, M.E. 2014. Analytical quality and acceptability of baked and fried banana chips. Journal of Human Nutrition & Food Science, 2(4): 1052."
NG1072,"Ene-Obong, H.N., Onuoha, N.O., Aburime, L.C & Mbah, O. 2015. Nutrient composition, Phytochemical and Anti-Oxidant Activities of Some Indigenous Spices in Southern Nigeria. Paper presented at the 11th International Food Data Conference (IFDC), 3–5 November 2015, Hyderabad, India, National Institute of Nutrition (NIN). "
NG1076,"Etefia, J.E. 2016. Proximate and mineral composition of groundnut. Department of Biochemistry, University of Calabar. (Undergraduate project)"
NG1081,"Ezeokeagu, H.N. 2010. The effect of different traditional cooking methods on the nature of starch on some Nigerian starchy foods. Department of Home Science, Nutrition and Dietetics, University of Nigeria. (Post-graduate project)"
NG1084,"Fakai, I.M., Sani, I. & Olalekan, O.S. 2015. Proximate composition and cholesterol content of egg obtained from various bird species. Journal of Harmonized Research in Medical and Health Sciences, 2(22): 18–25."
NG1093,"Ifie, I. & Emeruwa, C.H. 2011. Nutritional and anti-nutritional characteristics of the larva of Oryctes monoceros. Agriculture and Biology Journal of North America, 2(1): 42–46."
NG1094,"Ifop, F.U. 2014. Analytical survey of nutrients and contaminants in seafoods consumed in Calabar, Cross River State. Department of Biochemistry, University of Calabar. (Undergraduate project)"
NG1096,"Igbokwe, O.F. 2014. Studies on fatty acid and amino acid profiles of African breadfruit (Treculia africana) seeds. Department of Food Science and Technology, Michael Okpara University of Agriculture. (Undergraduate Project)"
NG1106,"Kayodele, O.D. 2015. Impacts of handling strategies on supplement maintenance of white yam (Dioscorea rotundata) items to nourishing intake of Nigerians. International Journal of Food Science and Microbiology, 2(4): 072–075."
NG1108,"Kosoko, S.B., Oluwole, O.B., Daramola, A.O., Adepoju, M.A., Oyelakin, A.J., Tugbobo-Amisu, A.O., Alagbe, G.O. & Elemo, G.N. 2014. Comparative quality evaluation of roasted cashew nut kernel: Effect of roasting methods. Advance Journal of Food Science and Technology, 6(12): 1362–1371."
NG1111,"Lawal, O.O., Agiang, M.A. & Eteng, M.U. 2012. Proximate and antinutrient composition of white Guinea yam (Dioscorea rotundata) diets consumed in Ibarapa, South West region of Nigeria. Journal of Natural Products of Plant Resources, 2(2): 256–260."
NG1112,"Madubuike, P.C., Onyema, C.T., Odinma, S.C. & Sokwaibe, C.E. 2014. Evaluation of mineral elements, cyanide and proximate composition of cassava (Mannihot esculenta crantz) from Ebony State, Nigeria. IOSR Journal of Environmental Science, Toxicology and Food Technology (IOSR-JESTFT), 8(8): 41–43."
NG1113,"Maina, H.M., Heidi, E.S. & Shaqal, M.H. 2012. Analytical screening of nutritional and non-essential components in unripe and ripe fruits of banana (Musa sapientum). International Journal of Medicinal Plant Research,1(3): 20–25."
NG1114,"Makanjuola, O.M., Ajayi, A.B., Mattew, K. & Makanjuola, J.O. 2013. The proximate composition and mineral contents of three plantain cultivars harvested at matured green level. International Journal of Innovations in Bio-Sciences, 3(2): 23–26."
NG1116,"Mazi, E., Okoronkwo, K.A & Ibe, U.K. 2013. Physico-chemical and nutritive properties of bitter kola (Garcinia Kola). Journal of Nutrition & Food Sciences, 3(4): 218."
NG1117,"Maziya-Dixon, B., Awoyale, W. & Dixon, A. 2015. Effect of processing on the retention of total carotenoid, iron and zinc contents of yellow-fleshed cassava roots. Journal of Food and Nutrition Research, 3(8): 483–488."
NG1120,"Modawi, S.Y.H. 2006. Nutritional evaluation and functional properties of flour of roasted pumpkin seeds. Department of Food Science and Technology, University of Khartoum. (MSc dissertation)"
NG1124,"Ndidi, S.U., Ndidi. C.U., Aimola, I.A., Obed, Y.B., Mankilik, M & Adamu, Z. 2014. Effects of processing (boiling and roasting) on the nutritional and antinutritional properties of bambara groundnuts (Vigna subterranea [L.] Verdc.) from Southern Kaduna, Nigeria. Journal of Food Processing, 2014: 1–9."
NG1125,"Ndife, J., Abdulraheem, L.O. & Zakari, U.M. 2010. Evaluation of the nutritional and sensory quality of functional breads produced from whole wheat and soya bean flour blends. African Journal of Food Science, 5(8): 466– 472."
NG1128,"Nicanuru, C., Laswai, H.S. & Sila, D.N. 2015. Effect of sun-drying on nutrient content of orange fleshed sweet potato tubers in Tanzania. Sky Journal of Food Science, 4(7): 091–101."
NG1129,"Njoku, J.N. 2005. Chemical, functional and sensory properties of blends of plantain flour, bambara groundnut flour and wheat flour for production of cake and biscuit. Michael Okpara University of Agriculture. (Undergraduate project)"
NG1135,"Nwauzon, E.N. 2004. Effect of fermentation on the nutrient content of quality protein Maize. Department of Biochemistry, University of Calabar. (Undergraduate project)"
NG1138,"Obasi, A., Ukadilonu, J., Eze, E., Akubugwo, E.I & Okorie, U.C. 2012. Proximate Composition, Extraction, Characterization and Comparative Assessment of Coconut (Cocos nucifera) and Melon (Colocynthis citrullus) Seeds and Seed Oils. Pakistan Journal of Biological Sciences, 15:1–9."
NG1140,"Oboh, H.A. & Erema, V.G. 2010. Glycemic indices of processed unripe plantain (Musa paradisiaca) meals. African Journal of Food Science, 4(8): 514–521."
NG1142,"Odebunmi, E.O., Oluwaniyi, O.O, Sanda, A.M. & Kolade, B.O. 2007. Nutritional composition of selected root crops used in Nigerian food preparation. International Journal of Chemistry, 17(1): 37–43."
NG1145,"Ogbonnaya, E.C. & Chinedum, E.K. 2013. Vitamin and carotenoid composition of raw and decoctions of water leaf (Talinum triangulare). Biochemistry & Pharmacology, 2(3): 121."
NG1154,"Ojieh, G. Oluba, O. Ogunlowo, Y. Adebisi, K., Eidangbe, G. & Orole, R. 2007. Compositional studies of Citrullus lanatus (Egusi Melon) seed. The Internet Journal of Nutrition and Wellness, 6(1): 1–5."
NG1157,"Oke, D.B., Tewe, O.O & Fetuga, B.L. 1995. The nutrient composition of cowpea varieties. Nigerian Journal of Animal Production, 22(1): 32–36."
NG1159,"Okeke, E.C., Ene-Obong, H.N., Uzuegbunam, A.O., Ozioko, A., Umeh, S.I & Chukwuone, N. 2009. The Igbo traditional food system documented in four states in southern Nigeria. In H.V. Kuhnlein, B. Erasmus & D. Spigelski, eds. Indigenous Peoples’ food systems: the many dimensions of culture, diversity and environment for nutrition and health, pp. 251–281. Rome, FAO."
NG1160,"Okeke, C.U., Ezeabara, C.A., Okoronkwo, O.F., Udechukwu, C.D. & Uka, C.J. 2015. Determination of nutritional and phytochemical compositions of two variants of bitter leaf (Vernonia amygdalina Del). Journal of Human Nutrition and Food Science, 3(3): 1065."
NG1162,"Oko, A.O., Famurewa, A.C. & Nwaza, J.O. 2015. Proximate composition, mineral elements and starch characteristics: study of eight (8) unripe plantain cultivars in Nigeria. British Journal of Applied Science & Technology, 6(3): 285–294."
NG1163,"Okolie, N.P. 2012. Comparative study on some selected garri samples sold in Lagos Metropolis. Journal of Food Studies, 1(1)."
NG1170,"Olatidoye, O.P & Sobowale, S.S. 2016. The effect of traditional processing methods on proximate, mineral composition and sensory qualities of three breeds of land snail reared in Edo State. Journal of Scientific Research in Pharmaceutical, Chemical & Biological Sciences, 1(1)."
NG1175,"Onuoha, O.N., Eme, P.E. & Ekpo, U.E. 2014. Chemical evaluation of unripe plantain dishes commonly consumed by Type 2 diabetics attending the University of Uyo Teaching Hospital in Akwa Ibom State, Nigeria. Pakistan Journal of Nutrition, 13(6): 331–334."
NG1176,"Onweluzo, J.C & Nwabugwu, C.C. 2009. Fermentation of millet (Pennisetum americanum) and pigeon pea (Cajanus cajan) seeds for flour production: Effects on Composition and Selected Functional Properties. Pakistan Journal of Nutrition, 8(6): 737–744."
NG1177,"Onyeike, E.N. & Oguike, J.U. 2003. Influence of heat processing methods on the nutrient composition and lipid characterization of groundnut (Arachis hypogaea) seed pastes. Biokemistri, 15(1): 34–43."
NG1178,"Onyema, C.T., Ekpunobi, U.C., Edowube, A.A., Odinma, S. & Sokwaibe, C.E. 2014. Quality assessment of common instant noodles sold in Nigeria markets. American Journal of Analytical Chemistry, 5(17): 1174–1177."
NG1179,"Onyenweaku, E.O., Ene-Obong, H.N & Ima, W. 2016. Proximate, mineral and vitamin composition of some eggs species consumed in Nigeria, in their raw and boiled forms. (Unpublished)"
NG1181,"Osunde, Z.D. & Musa Makama, A.L. 2007. Assessment of changes in nutritional values of locally sun-dried vegetables. AU Journal of Technology, 10(4): 248–253."
NG1184,"Otitoju, G.T.O., Otitoju, O., Nwamarah, J.U. & Baiyeri, S.O. 2015. Comparative study of the nutrient composition of four varieties of cowpea (Vigna unguiculata) and their products (beans-based products). Pakistan Journal of Nutrition, 14(9): 540–546."
NG1185,"Ochala, F.O. 2014. The effect of drying method on the vitamin C content of selected green leafy vegetables. Department of Biochemistry, University of Calabar. (Dissertation)"
NG1186,"Oyewole, O.E & Tijani, A.G. 2014. Public health nutrition potentials of two cultivars of commonly consumed cowpeas (“Oloyin” and “drum”) in south-west Nigeria. Nigerian Journal of Nutritional Sciences, 35(2): 74–79."
NG1187,"Ozumba, N.N. 2010. Nutrient composition and sensory evaluation of odudu oyibo (Moringa oleifera) leaves, pods and products. Department of Human Nutrition and Dietetics, Michael Okpara University of Agriculture."
NG1188,"Paiko, Y.B., Dauda, B.E., Sulaiman, M.A., Tanko, A.H & Jacob, J.O. 2013. Physico-chemical properties and metal ions content of oil extracted from cricket (Brachytrupes Membranaceus) in Bosso Local Government Area of Niger State, Nigeria. Asian Journal of Science and Technology, 4(5): 8–12."
NG1190,"Philip, O.E. 2012. Nutrient content of seedless breadfruit (Atocarpus communis) in comparison to African breadfruit (Treculia africana). Department of Human Nutrition and Dietetics, Michael Okpara University of Agriculture. (Undergraduate project)"
NG1191,"Pikuda, O.O & Ilelaboye, N.O. 2013. Proximate and chemical composition of OGI prepared from whole and powdered grains (maize, sorghum and millet). Annals of Biological Research, 4(7): 239–242."
NG1193,"Princewill-Ogbona, I.L. & Ibeji, C.C. 2015. Comparative study on nutritional and antinutritional compositions of three cultivars (red, green and yellow) of aerial yam (Dioscorea bulbifera). IOSR Journal of Environmental Science, Toxicology and Food Technology, 9(5): 79–86."
NG1200,"Tlhong, T.M. 2008. Meat quality of raw and processed guinea fowl (Numeda meleagris). Stellenbosch University. (MSc dissertation)"
NG1209,"Udofia, U.S. 2005. Effect of traditional processing techniques on leafy vegetables and starchy staples consumed in Akwa Ibom State, Nigeria. University of Nigeria. (PhD dissertation)"
NG1210,"Uhegbu, F.O., Onwuchekwa, C.C., Iweala, E.E. & Kanu, I. 2009. Effect of processing methods on nutritive and antinutritive properties of seeds of Brachystegia eurycoma and Detarium microcarpum from Nigeria. Pakistan Journal of Nutrition, 8(4): 316–320."
NG1212,"Ukom, A.N., Ojimelukwe, P.C., Ezeama, C.F., Ortiz, D. & Aragon, I.I. 2014. Proximate composition and carotenoid profile of yams (Dioscorea spp.) and cocoyam (Xanthosoma maffa (Scoth)) root tubers from Nigeria. American Journal of Food and Nutrition, 4(1): 1–10."
NG1216,"Ureigho, U.N. & Ekeke, B.A. 2010. Nutrient Values of Chrysophyllum albidum Linn African star apple as a domestic income plantation species. African Research Review, 4(2): 50–56."
